{
  "GroupRegistrationId": 6,
  "GroupNumber": "357185",
  "Description": "Empleadossstemp",
  "RegistrationDateFrom": "2025-08-01",
  "RegistrationDateTo": "2025-08-31",
  "PolicyEffectiveDate": "2004-06-01",
  "EmployerContribution": 125,
  "GroupEmailContact": "jcolonc@mapfrepr.com;fpereira@mapfrepr.com",
  "ProducerNumber": "(787)-888-8888",
  "EmployerContributionFlag": true,
  "EmloadPlanNumber": "MFC - 71",
  "EmloadClass": "2A",
  "EmloadPCS": "W603 Q096",
  "EmloadSpoBenClass": "A",
  "EmloadDepBenClass": "A",
  "GroupType": "C",
  "PlansByLocationFlag": true,
  "EmloadPerLocationFlag": false,
  "LifeFlag": false,
  "LifeOptionalFlag": null,
  "JointFlag": true,
  "ColateralFlag": true,
  "Active": true,
  "CreatedBy": "EMUNIZ",
  "CreatedDate": "2025-08-05"
}
